<?xml version="1.0" encoding="utf-8"?>
<Extensions xmlns="https://www.alibaba.com/matrix/extension"
            xmlns:xsi="http://www.w3.org/2001/XMLSchema-instance"
            xsi:schemaLocation="https://www.alibaba.com/matrix/extension https://www.alibaba.com/matrix/extension.xsd">

    <Extension class="com.alibaba.matrix.extension.test.ext.ShowDemoExt" base="showDemoExtBaseImpl">
        <ExtensionImpl code="my-code-2" type="http" priority="1">
            <http url="http://localhost:8080/" method="POST"/>
        </ExtensionImpl>

    </Extension>

    <Extension class="java.util.function.Function" base="baseFunctionImpl" desc="测试扩展Function定义">
        <ExtensionImpl scope="BASE, XXX" code="yhb, xxx" type="bean" desc="验货宝">
            <bean class="com.alibaba.matrix.extension.test.impl.function.YhbFunctionImpl"/>
        </ExtensionImpl>
        <ExtensionImpl code="groovy" type="http">
            <http url="xxx"/>
        </ExtensionImpl>
    </Extension>

    <Extension class="java.util.function.BiFunction" base="baseBiFunctionImpl">
        <ExtensionImpl code="groovy" type="groovy">
<!--            <groovy protocol="nacos" path="serverAddr=localhost:8848;namespace=c8914181-d464-4f9b-a9d6-2a124205793a;dataId=bg-aristotle-api.force.h5.uid.gray;scope=DEFAULT_scope"/>-->
            <groovy protocol="file" path="/Users/feiqing.zjf/IdeaProjects/自己/demo/src/test/java/com/alibaba/matrix/demo/Test.groovy"/>
<!--            <groovy protocol="http" path="http://127.0.0.1:8080/test.groovy"/>-->
        </ExtensionImpl>
    </Extension>

    <Extension class="java.util.function.Supplier" base="baseSupplierImpl" desc="测试扩展Supplier定义">
        <ExtensionImpl scope="BASE" code="xxx, hhh" type="dubbo">
            <dubbo version="xxx" group="xxx" lazy="true"/>
        </ExtensionImpl>
        <ExtensionImpl scope="BASE" code="xxx" type="bean" desc="">
            <bean name="xxx" class="java.util.function.Supplier" lazy="true"/>
        </ExtensionImpl>
        <ExtensionImpl code="yhb" type="hsf" desc="验货宝">
            <hsf service="xxx" group="xxx" version="xxx.yhb" lazy="true"/>
        </ExtensionImpl>
        <ExtensionImpl code="dubbo" type="dubbo">
            <dubbo version="sss" timeout="100" check="true" group="xxx" lazy="true"/>
        </ExtensionImpl>
        <ExtensionImpl code="http" type="http">
            <http url="https://www.baidu.com/rest/" method="POST" camelToUnderline="true"/>
        </ExtensionImpl>
    </Extension>

    <!--
    <Extension class="com.alibaba.matrix.test.extension.spi.OrderCreateSpi" base="baseOrderCreateSpiImpl"
               desc="下单扩展能力">
        <ExtensionImpl code="normal" type="bean" desc="普通电商交易">
            <bean name="normalOrderCreateSpiImpl"/>
        </ExtensionImpl>
        <ExtensionImpl code="o2c" type="bean" desc="O2O交易">
            <bean name="o2OOrderCreateSpiImpl"/>
        </ExtensionImpl>
    </Extension>
    -->

</Extensions>