<?xml version="1.0" encoding="utf-8"?>
<Extensions xmlns="https://www.alibaba.com/matrix/extension"
            xmlns:xsi="http://www.w3.org/2001/XMLSchema-instance"
            xsi:schemaLocation="https://www.alibaba.com/matrix/extension
            https://www.alibaba.com/matrix/extension.xsd">

    <Extension class="java.util.function.Consumer" desc="测试扩展Consumer定义">
        <ExtensionBase type="bean">
            <bean name="baseConsumerImpl"/>
        </ExtensionBase>
    </Extension>

    <Extension class="java.util.function.Function" desc="测试扩展Function定义">
        <ExtensionBase type="bean">
            <bean name="baseFunctionExtImpl"/>
        </ExtensionBase>
        <ExtensionImpl priority="1" namespace="BASE, SUB-SCOPE" code="normal" type="bean" desc="普通电商交易">
            <bean name="normalFunctionExtImpl"/>
        </ExtensionImpl>
        <ExtensionImpl priority="2" code="normal" type="bean" desc="普通电商交易">
            <bean class="com.alibaba.matrix.extension.test.impl.function.NormalPriority2FunctionExtImpl"/>
        </ExtensionImpl>
        <ExtensionImpl namespace="BASE, SUB-SCOPE" code="yhb" type="bean" desc="验货宝交易">
            <bean class="com.alibaba.matrix.extension.test.impl.function.YhbFunctionExtImpl"/>
        </ExtensionImpl>
    </Extension>

    <Extension class="java.util.function.Supplier" desc="测试扩展Supplier定义">
        <ExtensionBase type="bean">
            <bean name="baseSupplierExtImpl"/>
        </ExtensionBase>
        <ExtensionImpl code="normal" type="bean" desc="普通电商交易">
            <bean name="normalSupplierExtImpl"/>
        </ExtensionImpl>
        <ExtensionImpl namespace="SUB-SCOPE" code="yhb" type="bean" desc="验货宝交易">
            <bean class="com.alibaba.matrix.extension.test.impl.function.YhbSupplierExtImpl"/>
        </ExtensionImpl>
    </Extension>

    <Extension class="java.util.function.BiConsumer" desc="测试扩展BiConsumer定义">
        <ExtensionBase type="bean">
            <bean name="baseBiConsumerImpl"/>
        </ExtensionBase>
    </Extension>

    <Extension class="java.util.function.BiFunction" desc="测试扩展BiFunction定义">
        <ExtensionBase type="bean">
            <bean name="baseBiFunctionImpl"/>
        </ExtensionBase>
    </Extension>

</Extensions>